title,company,kind,region
React Native Developer,RemoteMore,Full-Time,Americas Only/Europe Only/Africa Only
Senior Full-Stack Developer Experienced in PHP  React and MySQL,OnTheGoSystems,Full-Time,Europe Only/UK Only/Africa Only
Senior Open Source Developer & DevOps (Python  Django  React  AWS/OpenStack),OpenCraft,Full-Time,Anywhere in the World
Senior RoR / React developer for a Mass-Market SaaS Product,OnTheGoSystems,Full-Time,Europe Only/UK Only/EMEA Only/Africa Only
Senior Full Stack (Rails/React) Engineer,Brightline Health,Full-Time,USA Only
Full stack Javascript Developer (React.js + Node.js),UpStack Technologies  Inc.,Full-Time,Latin America Only/Europe Only
Frontend Engineer (ES8/React/Redux/Saga) ,Files.com,Full-Time,USA Only
Senior Rails + React Engineer to help fight evil,Simplero,Full-Time,Anywhere in the World
JavaScript Developer (React or Vue or Angular.. with Node.js),RemoteMore,Full-Time,Anywhere in the World
Principal React Native Developer (Fully Remote  US only),G2i Inc.,Full-Time,USA Only
Full Stack React Web Developers,silverorange,Full-Time,Canada Only
Full-stack Developer (React/Node),Lemon.io,Full-Time,Latin America Only/Europe Only
Full-Stack / Frontend Engineer - React / Ruby,TimeZest,Full-Time,Anywhere in the World
Lead Golang/React Developer,Innovation Upstream Inc,Full-Time,Anywhere in the World
Ruby on Rails / React Software Engineer,User Interviews,Full-Time,USA Only
Senior Engineer: Django + React.js,Credo Health,Full-Time,Anywhere in the World
Senior React Developer,G2i Inc.,Contract,Anywhere in the World
Senior Front-End Engineer (Node.js/React),Crowdcast,Full-Time,Anywhere in the World
Staff Front End Engineer - React,Facet Wealth,Full-Time,Anywhere in the World
React.js Software Developer - Remote,UpStack Technologies  Inc.,Full-Time,Americas Only/Europe Only
Senior React Developer,Toptal,Contract,Anywhere in the World
Mid-Senior or Senior React Developer,G2i Inc.,Contract,Anywhere in the World
Front-end Engineer (React),MercuryWorks,Full-Time,USA Only
Senior Front-end Engineer (React),Circle,Full-Time,Anywhere in the World
Mobile Engineer  React Native,Trustworthy,Full-Time,Anywhere in the World
Senior Front-End React Native Engineer,Maharishi Foundation International,Full-Time,Anywhere in the World
Senior Frontend Engineer (React.js),GOhiring,Full-Time,Anywhere in the World
React Software Engineer,BuildBook,Full-Time,North America Only
Senior Front End Developer (React),Cavallo,Full-Time,USA Only
Front-End React Developer,Consciously,Full-Time,USA Only
ReactJS Web Developer - Remote/SaaS (m/f/d),SocialHub,Full-Time,EMEA Only
Senior or Staff Frontend Engineer - React (100% Remote),Close,Full-Time,Americas Only
Senior Software Engineer - React,Method  Inc.,Full-Time,USA Only
React Frontend Developer,YASSI,Full-Time,USA Only
Senior React Native Developer-Remote,thoughtbot,Full-Time,Anywhere in the World
